{
  "$schema": "schema/changelog.schema.json",
  "intro": ["Each merge to main bumps the patch version. A minor version marks a milestone."],
  "tracked_from": "0.3.12",
  "unreleased": {
    "notes": ["The next milestone is every iced example, and every example in `examples/`, running under `rawr run` through importer-generated bindings only.","rawr-iced is being retired step by step, so that removing it ends up a no-op."],
    "entries": [
      {"text":"Reuse verified crate extraction tables across projects, with atomic publication, active-reader protection and removal by last use. Small whole-crate entries can serve later item demands without another nightly build; larger entries currently reuse their recorded subset.","issues":[367,272],"refs":[271,281]},
      {"text":"Validate declared files, environment and compiler inputs before reusing bindings. Differences between nightly and project build-script outputs keep bindings local with diagnostics, and changes to external declared inputs reach a running app.","issues":[275]}
    ]
  },
  "releases": [
    {
      "version": "0.3.17",
      "date": "2026-10-29",
      "entries": [
        {"text":"Call a crate trait's provided value-self method on a script type, including blanket impls and macro paths. The unchanged iced custom_widget example now renders through generated bindings.","issues":[359]},
        {"text":"Call methods through a public alias of a concrete generic crate type, including iced's Renderer with private graphics backends. Native compilation checks the concrete implementation's bounds.","issues":[360]},
        {"text":"Infer generic imported struct literals from fields and surrounding uses, and assign fields through borrowed native values. This includes nested Copy field updates.","issues":[364]}
      ]
    },
    {
      "version": "0.3.16",
      "date": "2026-10-29",
      "entries": [
        {"text":"A generic method, and a generic whose parameter reaches a crate item only in its body, is compiled once per instantiation its callers use, and a view that passes a later method's opaque output to a crate function builds from a fresh cache.","issues":[341]},
        {"text":"A script impl of a crate trait generic over a crate-bounded parameter, as custom_quad's `impl<Message, Theme, Renderer> Widget<..> for Quad where Renderer: renderer::Renderer`, is compiled for each use a crate's bound makes of it, so its body calls the renderer at its type.","issues":[322]},
        {"text":"A script impl whose signatures name its own parameter, as component's `Option<Message>`, and whose view returns `impl Widget<..> + 'a`, crosses, and a trait with lifetime arguments, as `Component<'a, Message>`, is selected and written in the runner.","issues":[323]},
        {"text":"An associated type Rust code would hold as a script value, as the_matrix's `type State = RefCell<Vec<Cache>>`, crosses as a proxy whose `Default` is the type's.","issues":[324]}
      ]
    },
    {
      "version": "0.3.15",
      "date": "2026-10-28",
      "entries": [
        {"text":"A view's column of text made from an iterator, as iced's text and events examples make it, now builds. rawr reads each type's lifetime variance from rustc, and a value made outside the view joins the view's region only when its type is covariant.","issues":[335]},
        {"text":"A function iced runs on its executor thread with crate values, such as `Task::map(Result::ok)` or `listen_with`'s filter, runs with an arena of its own for the call. Upstream text and events run with no rawr-iced.","issues":[347]}
      ]
    },
    {
      "version": "0.3.14",
      "date": "2026-10-28",
      "entries": [
        {"text":"A float range such as `1.0..=30.0` passes where a crate takes `RangeInclusive<T>`. `T` becomes the float the call's other arguments give, as in iced's `slider`.","issues":[355],"refs":[314]},
        {"text":"An array literal such as `[10, 20]` passes where a crate takes `impl Into<T>` and `T` converts from an array of that length, as in iced's `padding([10, 20])`. iced's exit runs with no rawr-iced.","issues":[336]},
        {"text":"`.into()` on a crate value converts into the crate type its use expects, even when the program never names that type, as in iced's modal `Some(Color { .. }.into())`.","issues":[340]},
        {"text":"A borrowed `Vec` passes where a crate takes `impl IntoIterator<Item = T>`, and its items are borrows, as in iced's `table(columns, &self.events)`. A script type named `Event` no longer clashes with the generated runner's own code.","issues":[356],"refs":[345]}
      ]
    },
    {
      "version": "0.3.13",
      "date": "2026-10-28",
      "entries": [
        {"text":"A boot function that returns the state and a task, as iced's `new() -> (Self, Task<Message>)`, runs as `application(Example::new, ..)` takes it.","issues":[300]},
        {"text":"A message made from a crate value on another thread, as `Task::map(Message::InformationReceived)` on iced's executor, is made where it is delivered. iced's system_information runs with no rawr-iced.","issues":[300]},
        {"text":"A `Vec` inside a crate type's arguments, a function-pointer parameter such as `event::listen_with`'s, a bounded generic associated function such as `Task::done` passed as a callable, an `Option` or `Result` of crate values, and a slice of crate values such as `pick_list` takes all cross. iced's text passes `rawr check`.","issues":[300]}
      ]
    },
    {
      "version": "0.3.12",
      "date": "2026-10-28",
      "entries": [
        {"text":"A crate's re-export of a std item is that item. `use iced::time::{Duration, Instant};` names std's `Duration` and `Instant`, and so do `time::Duration` after `use iced::time;` and `iced::time::Instant::now()`. Before, rawr refused the import as \"a standard library definition\".","issues":[312]},
        {"text":"A std type a crate re-exports under another name, as `iced::Never` is std's `Infallible`, is that type under the new name in types. So is `use std::time::Duration as Span;`. Calls through the new name, such as `Span::from_secs(1)`, aren't supported yet.","issues":[312],"refs":[344]},
        {"text":"std's `Instant` crosses into and out of a crate by value, as `Duration` does. `time::every(milliseconds(10))`, which gives a `Subscription<Instant>`, has a binding, and `.map(Message::Tick)` hands each tick's `Instant` to the script.","issues":[338]},
        {"text":"`{:?}` of an `Instant` prints as Rust prints it, `Instant { tv_sec: .., tv_nsec: .. }`. Before, rawr printed `<timestamp>`.","issues":[338]},
        {"text":"Upstream iced's stopwatch, ferris, game_of_life, table and markdown get past their `iced::time` imports, and clock and the_matrix get past `time::every`. geometry gets past `use iced::Never`. Each still stops at a later gap.","issues":[312,338]}
      ]
    },
    {
      "version": "0.3.11",
      "date": "2026-10-28",
      "entries": [
        {"text":"A method that a crate's extension trait gives every type through a blanket impl, such as iced's `.boxed()` on a `Container`, `Text` or `Scrollable`, is found. Before, rawr said \"no method named `boxed`\". The blanket impl applies through the type's own impl of the trait its where-clause names, which fixes the trait's arguments. Upstream iced's multi_window, scrollable and system_information get past it.","issues":[]},
        {"text":"A generic function whose signature names a crate's type or trait runs under `rawr run`. This covers a parameter written `impl Widget<Message>`, and a helper generic over its message that builds a crate widget. rawr compiles it once per instantiation its callers use, as Rust does, and each call runs its own instance. Before, `impl Widget<Message>` in a parameter was \"unknown type `Widget`\", and a crate call inside a generic function failed with \"not one exact concrete surface type\". A type the argument leaves open, such as a widget's renderer, is fixed by the trait's defaults and the crate's impls. Upstream iced's modal and toast get past it. Other generic functions are still compiled once, as before.","issues":[]}
      ]
    },
    {
      "version": "0.3.10",
      "date": "2026-10-28",
      "entries": [
        {"text":"Upstream iced's `url_handler` example runs under `rawr run` without rawr-iced. Its window matches `cargo run`'s.","issues":[]},
        {"text":"`iced::application(..).subscription(App::subscription)` works. The subscription takes `&P::State` and gives a `Subscription<P::Message>`, where `P` is the opaque program `application(..)` gives. Before, rawr said \"it takes a callable rawr can't make\". A crate method's callable now reads an associated type of a type parameter as a type the call infers, wherever the callable's inputs or output name it.","issues":[]},
        {"text":"A method of a generic impl takes a script function as a slot, as a crate function does. A script state it lends by reference is shared, not copied.","issues":[]},
        {"text":"A call on one opaque program that gives another, as `.subscription(..)` does, is compiled where it is made, and so are the calls on the program it gives, such as `.run()`.","issues":[]},
        {"text":"A crate method whose impl puts its own parameter inside the type, as iced's `impl<T> Task<Option<T>>` does for `and_then`, now has a binding. When the crate overloads the method by the receiver's type argument, as `Task<Option<T>>` and `Task<Result<T, E>>` do, the receiver picks the form.","issues":[]},
        {"text":"A generic crate function can be passed as a value, as in `window::latest().and_then(window::close)`. Its type arguments are inferred from where it goes. Before, rawr said it \"must be monomorphic\".","issues":[]},
        {"text":"A `&str` that a widget keeps through its lifetime, as `text(url)` keeps the `&String` it is given, is pinned in the view's region. Before, the runner's build failed with E0597.","issues":[]},